MIT,219,PACS II: Comm and Admin,3,0,3,"Study of policies and procedures for PACS. Observation of the healthcare organization and PACS role within the organization. Overview of PACS components, image acquisition viewing of images, and image archiving. "
MIT,229,PACS III: Tech Req & Imag Qual,3,0,3,"Overview of computer basics, technical requirements, and Operating System basics. An introduction to HIPAA and PACS image quality. "
MIT,231,Sonographic Princ & Instru I,3,3,4,"Properties of sound waves, propagation and interaction of ultrasound in tissue, basic ultrasound instrumentation, static, and real-time ultrasound imaging principles and artifacts are covered. Laboratory includes demonstration of wave characteristics and introduction to basic instrumentation of real-time ultrasound imaging. "
MIT,232,Sonographic Princ & Instru II,3,3,4,"Advanced physical principles. Hemodynamics, Doppler physics, color imaging, and artifacts associated with them are covered. Digital signal and image processing and bioeffects are also discussed. Laboratory develops instrumentation skills. "
MIT,239,PACS IV: Implem & Sys Mgmt,3,0,3,"Overview of implementing PACS. Starting from procurement to the Return of Investment (ROI). This will include the proposal, approval process, integration, a post install. Class will include the study of DICOM and HL7. "
MIT,249,PACS V: DICOM,3,0,3,Study of the DICOM standard and how it allows for modalities to commuinicate inside and outside of a facility. 
MIT,259,PACS VI: PACS Security,3,0,3,"Overview of Information Technology, IHE, security, structured reporting and networking fundamentals. "
MIT,305,Medical Imaging Tech Practicum,1,0,1,The MIT Lab Paracticum is a remedial section desigened for imaging learners who plan to retake a sophmore year programmatic course or are returning to a program after brief haitus. To be successful in Medical Imaging it is neccessary to review essential didactic information and clinical skills in preparation for advancing in that program. Curriculum for this course is customized to each learner's needs and will be outline in their objectives.Prerequsite: Junior standing in a Medical Imaging program 
MIT,341,Magnetic Resonance Imaging,3,3,4,"Physics and principles used in the production used in the production of magnetic resonance images and spectroscopy, including: safety issues, static and gradient magnetic fields, coils, resonance, frequencies, relaxation, and computer applications. Basic pulse sequences are examined in detail. "
MIT,342,Mag. Resonance Imaging II,3,0,3,"Advanced principles used in the production of magnetic resonance images. MRI safety, coil function and selection, advanced pulse sequences, magnetic resonance angiography (MRA), motion control techniques, pathology, artifacts, functional magnetic resonance imaging (fMRI). "
MIT,365,Mag. Resonance Imaging Review,2,0,2,Review of MR principles of image production for practicing and training MR technologists who intend to sit for the American Registry of Radiologic Technologists MRI examination. 
MIT,405,Medical Imaging Tech Practicum,1,0,1,The MIT Lab Paracticum is a remedial section desigened for imaging learners who plan to retake a sophmore year programmatic course or are returning to a program after brief haitus. To be successful in Medical Imaging it is neccessary to review essential didactic information and clinical skills in preparation for advancing in that program. Curriculum for this course is customized to each learner's needs and will be outline in their objectives.Prerequsite: Senior standing in a Medical Imaging program or working toward an advanced level certification. 
MIT,411,Magnetic Resonance Externship,0,13,5,"This one-term (3-month) practicum is designed to develop the skills of the student in the special imaging modalities, i.e., computed tomography, magnetic resonance imaging, ultrasound, nuclear medicine and special radiographic procedures. The student is sent to an affiliated hospital that has the required specail imaging equipment to give the hands-on experience to develop competency in each of three areas chosen by the student. The student will spend one month in each selected area. "
MIT,356,Computed Tomography II,2,3,3,"CT patient care, radiation dose reduction, and adverse effects of contrast media. Sectional anatomy and pathology of the abdomen, pelvis, chest, head, and spine. Laboratory simulation of imaging protocols and scan post processing. Preparation for ARRT CT registry examination. "
MIT,310,Cadaver Imaging Problems,2,0,2,"Cadaver imaging is a group centered project that allows imaging student to advance their technical, professional, and leadership skills. The process of imaging a human cadaver presents unique opportunities to identify and solve an infinite variety of complex problems. "
MIT,225,Patient Care in Sonography,2,3,3,"Basic concepts of patient care, infection control procedures, transport of critically ill patients, and recognition of emergency situations. Sonographers responsibility to the patient, the patient's family, and the sonography profession. "
MLS,100,Introduction to MLS,1,3,2,"Orientation to the theory and practice of all aspects of the Medical Laboratory Science profession. The history of Medical Laboratory Science, professional organizations and career opportunities are discussed. "
MLS,107,Seminar,15,15,15,(Hours to be arranged each term.) 
MLS,207,Seminar,0,0,15,(Hours to be arranged each term.) 
MLS,307,Seminar,15,0,15,(Hours to be arranged each term.) 
MLS,407,Seminar,0,0,10,(Hours to be arranged each term.) 
MLS,415,Clinical Chemistry I,5,3,6,"Fundamentals of chemical analysis of body fluids. Laboratory practice in chemical formats, data evaluation, laboratory utilization, and quality control theory. Laboratory exercises linked to lectures: amino acids, proteins, carbohydrates, lipids, blood gases, enzymes, trace elements, electrochemistry, osmometry, electrophoresis, and spectroscopy. "
MLS,416,Clinical Chemistry II,5,3,6,"Fundamentals of chemical analysis of body fluids. Laboratory practice in chemical formats, data evaluation, laboratory utilization, and quality control theory. Laboratory exercises linked to lectures: renal and liver function, porphyrins, hormones, pregnancy, fetal development, bone metabolism, nutrition, and geriatrics. "
MLS,417,Clinical Chemistry III,2,0,2,"The theory, practical application and technical performance of chemical analysis. Emphasis on theory of therapeutic drug monitoring, toxicology, proteomics, individualized screening, and method validation. "
MLS,420,Clinic Immun & Infect Serology,4,3,5,"Lecture/laboratory coverage of human immunity, including innate and adaptive immunity, immune system organs, tissues, and activation. Immunological methods used in the clinical lab to assess human immune response in health and in various disease states are studied. "
MLS,422,Molecular Diagnostics,3,3,4,"Coverage of molecular techniques used in the clinical laboratory to diagnose disease associated with bacteria, viruses and genetic deficiencies. Topics covered include principles of molecular biology, nucleic acid isolation, purification, amplification, quantitation, and discrimination. Specimen collection/handling, viral culturing and molecular lab operations are also covered. "
MLS,424,Hemostasis,2,3,3,"Lecture and laboratory coverage of the mechanisms of hemostasis and basic pathophysiology of hemostatic disorders. Student perform laboratory procedures pertaining to hemostasis, interpret results and correlate with other laboratory data to identify disease states. "
MLS,432,Foundations of MLS I,3,3,4,"The first of three courses covering essential professional practice issues. Subjects covered include: quality control/quality assurance, laboratory safety, laboratory mathematics, ethics, educational methods and phlebotomy. "
MLS,442,Hematology I,4,6,6,Lecture and lab coverage of normal development and function of blood cells. Students learn to evaluate normal and abnormal blood cell morphology through microscopic examination of blood smears. Students perform laboratory procedures pertaining to hematology. 
MLS,443,Immunohematology I,3,3,4,"Lecture and lab coverage of immunohematology with practical application in the contemporary blood bank laboratory. Topics covered include blood groups biochemistry, genetics, and immunology, test methods and transfusion practices including donor selection, component preparation, quality management and compliance issues. "
MLS,444,Microbiology I,4,6,6,Lecture/lab coverage of human bacterial pathogens seen in the clinical laboratory including gram positive and gram negative bacilli. Principles and methods of clinical microbiology laboratory diagnosis of bacterial diseases are studied. 
MLS,445,Microbiology II,2,6,4,"Lecture/lab coverage of diseases caused by, and clinical laboratory identification of, human microbial organisms including anaerobes, spirochetes, mycobacteria, chlamydia, and rickettsia. Interpretation of clinical specimens, identification of pathogens, and the recognition of normal flora is also studied. "
MLS,449,Principles of Urinalysis,2,3,3,"Lecture and laboratory coverage of renal function, urine formation, and methods used to analyze urine in the medical laboratory. Students perform physical, chemical, and microscopic analyses on clinical samples and correlate results with states of health and disease in man. "
MLS,452,Hematology II,4,3,5,"Comprehensive study of the pathophysiology of hematological disorders. Students perform microscopic examination of blood films, interpret results and correlate with other laboratory data to identify disease states. "
MLS,453,Immunohematology II,2,3,3,Continued study of immunohematology emphasizing clinical decision-making and problem-solving related to blood banking and transfusion therapy practices. 
MLS,462,Foundations of MLS II,2,3,3,"The second of three courses covering essential professional practice issues. Subjects covered include: educational methods, clinical laboratory management, and research. "
MLS,463,Foundations of MLS III,0,3,1,"Third of three courses covering essential professional practice issues. Emphasis on practical experience through the application of theories and concepts of professional development, laboratory operations and supervision at an approved off campus clinical site. "
MLS,464,Medical Mycology and Parasitology,2,3,3,Lecture and laboratory coverage of medically important fungi and parasites with emphasis on those seen in the clinical laboratory. Principles and methods of clinical laboratory diagnosis of infections and diseases caused by these organisms are studied. 
MLS,470,Chemistry & Immunology Extern,0,9,3,Three weeks full-time practical experience at an approved off-campus clinical site emphasizing application of knowledge and skills to perform a wide variety of testing in a contemporary clinical chemistry/immunology laboratory and further develop discipline-specific competency. 
MLS,471,Hematology Externship,0,9,3,Three weeks full-time practical experience at an approved off campus clinical site emphasizing application of knowledge and skills to perform a wide variety of testing in a contemporary clinical hematology laboratory and further develop discipline-specific competency. 
MLS,472,Microbiology Externship,0,9,3,Three weeks full-time practical experience at an approved off-campus clinical site emphasizing application of knowledge and skills to perform a wide variety of testing in a contemporary clinical Microbiology laboratory and further develop discipline-specific competency. 
MLS,473,Immunohematology Extern,0,9,3,Practical experience at an approved off-campus clinical site emphasizing application of knowledge and skills to perform a wide variety of testing in a contemporary blood bank laboratory and further develop discipline-specific bank laboratory and further develop discipline-specific competency. 
MLS,475,MLS Capstone,1,3,2,"Capstone experience to include student projects covering method validation, development and writing of standard operating procedures, implementation of laboratory training programs and other advanced topics.   "
NMT,107,Seminar,0,0,15,(Hours to be arranged each term.) 
NMT,207,Seminar,0,0,12,(Hours to be arranged each term.) 
NMT,307,Seminar,12,0,12,(Hours to be arranged each term.) 
NMT,407,Seminar,0,0,12,(Hours to be arranged each term.) 
NMT,205,Nuclear Med Admin,3,0,3,"Orientation to the principles of management, marketing nuclear medicine services, and administrative procedures. "
NMT,212,Nuc Med Phy/Radiation Biophy,3,0,3,"Interactions of radiation with matter. Introduction to the cellular and systemic responses to radiation. Early and late somatic and genetic effects described. Critical organ dose calculations risks versus benefits. Overview of film processors, associated chemistry. "
NMT,215,Radiochem/Radiopharmacy,3,3,4,"The design and function of radionuclide generators, labeling procedures, sterility and pyrogenicity considerations, radionuclide and radiochemical quality control procedures. "
NMT,217,Patient Care,3,3,4,"Basic concepts of patient care, including consideration of physical and psychological needs of the patient and family. Routine and emergency patient care procedures. Infection control procedures utilizing Universal Precautions. Role of the nuclear medicine technologist in patient education. "
NMT,225,Nuclear Phy/Instrumtn,3,3,4,"An in-depth examination of the physics in nuclear medicine, principles of detection, considerations of counting and imaging, collimators, planar imaging and associated quality assurance and control. Use of all major instrumentation in nuclear medicine departments. "
NMT,256,Cardiovascular Imaging,3,0,3,"Introduction to Cardiovasccular Imagining techniques in Nuclear Medicine including planar, SPECT, and PET imaging acquisition and processing protocols, radiopharmaceuticals, cardiac anatomy and physiology, exercise and pharmacological stress testing, and EKG principles. "
NMT,311,Imaging Procedures I,3,3,4,"Proper patient care before, during, and after the procedure, identification and administration of prescribed radio pharmaceuticals. The use of imaging devices and external detectors for body organ imaging. "
NMT,312,Imaging Procedures II,3,3,4,"Proper patient care before, during and after the procedure, identification and administration of prescribed radio pharmaceuticals. The use of imaging devices and external detectors for body organ imaging. "
NMT,313,Therapeutic Procedures,3,0,3,"Common Therapeutic applications of radionuclides, dose ranges for each application, and proper techniques for calculating quantities of administered radiopharmaceuticals. Includes patient care, follow-up procedures and disposal of excreta. "
NMT,315,Breast Imaging,1,0,1,"An in-depth analysis of breast anatomy and physiology, positioning, and interventional methods. Patient education and breast cancer statics will also be discussed at great lengths. "
NMT,325,SPECT Imaging/Comp Appl,3,3,4,"Single photon emission computed tomography (SPECT) imaging and computer applications as applied to nuclear medicine imaging. Demonstration of computer techniques and ECG monitoring and interpretation. Theoretic basis of computer operations and medical applications in nuclear medicine. Lab experience with computerized systems, including hospital sites. "
NMT,355,Computed Tomography,3,3,4,"X-ray physics, scanner components, and data acquisition of computed tomography. Image reconstruction, manipulation, and artifacts. CT patient care and imaging procedures of the head, neck, spine, chest, abdomen, pelvis and musculoskeletal system. Laboratory simulator practice on image manipulation, scan post processing and reconstruction. "
NMT,367,PET Imaging,3,0,3,"Introduction to Position Emission Tomography (PET) imaging techniques including acquisition protocols, processing protocols, quality control procedures, radiation protection, patient screening, radiopharmaceuticals, image fusion, and imaging procedures. "
NMT,388,Externship Preparation,3,0,3,Review and summarize key concepts in Nuclear Medicine. Focus is on patient care and interpersonal scenarios the externship student will likely face while in the hospital environment. Review and discussion of the NMT Externship Handbook and Procedures Log. 
NMT,410,Nuclear Med Tech Extern,0,0,15,All students must complete four consecutive terms (12 months) of clinical experience in nuclear medicine technology at an OIT approved site. Students will work under the direct supervision of a registered Nuclear Medicine Technologist. 
PHED,107,Seminar,4,0,4,(Hours to be arranged each term.) 
PHED,307,Seminar,0,0,15,(Hours to be arranged each term.) 
PHED,407,Seminar,0,0,15,(Hours to be arranged each term.) 
PHED,111,Core Strength and Balance,0,3,1,"BOSU ball training to improve balance and core strength and alleviate back pain and instability. This class includes full body training, using floor work, cardio circuits, and isometric exercises. "
PHED,113,Super Circuit/Cardio Training,0,3,1,"This course is designed to use a combination of free weights and/or the universal machines, along with cardiovascular fitness to provide a comprehensive program to increase muscle strength and endurance. "
PHED,122,Total Fitness Conditioning II,0,3,1,"Opportunity to do an independent study of a selected aspect of physical education. Class designed to develop and encourage healthy attitudes and habits with regard to body composition, muscular strength and endurance. Geared toward weight training workouts. "
PHED,121,Total Fitness Conditioning I,0,3,1,"Opportunity to do an independent study of a selected aspect of physical education. Class designed to develop and encourage healthy attitudes and habits with regard to cardiovascular efficiency, body composition, muscular strength and endurance, and flexibility. "
PHED,145,Relaxation and Flexibility,0,3,1,"Explore Tai Chi and Qigong methods for stress reduction and faciliatation of balance and flexibility. Other stress reduction methods include autogenic training, progressive muscle relaxation, and self-hypnosis. Explore the impact of cardiorespiratory exercise and diet on stress management. "
PHED,146,Yoga,0,3,1,"Class is generally Hatha Yoga, along with basic Ashitanga, and Kundalini Yoga techniques. In yoga a participant can hope to improve their flexibility, strength and balance. "
PHED,151,Karate,0,3,1,"Dive into the very heart and soul of Karate! Teachings in traditional forms, self-defense, and competitive style point sparring. Great for new and experienced students. Promotes physical activity, increased mobility, and awareness while learning a valuable life skill. "
PHED,163,Wilderness Navigation,0,3,1,"Learn to read a map and utilize a compass. Gain skill to find precise wilderness locations. Learn the dangers of wilderness travel, and deal with those situations. Two field trips polish skills using map and compass to navigate. "
PHED,174,Recreational Basketball,0,3,1,Basketball game played in a recreational environment. Emphasis on free play and team skill development. Most suitable for players with basic basketball skills. 
PHED,175,Rugby,0,3,1,"Basic rugby skill, practice, and game play. Players of any skill level welcome. Participants should be able to engage in physical contact, strength development, endurance training, team practice, and game play. "
PHED,180,Varsity Cross Country,0,3,1,"Competitive Cross Country for multi-level distance runners. Trail running, conditioning, strength training, psychological peak performance, nutrition, race tactics, running physiology and injury prevention is included. Participation in intercollegiate competition is included. Varsity athletes only or coaches approval. "
PHED,181,Varsity Soccer,0,3,1,"Competitive Soccer at the intercollegiate level, including coaching strategies, offensive and defensive strategies, training, conditioning and team organization. Varsity athletes only or coach's approval. "
PHED,182,Varsity Track/Field,0,3,1,"Competitive Track and Field techniques are covered including training, conditioning and team organization. Competition at the intercollegiate level. Varsity athletes only or coach's approval. "
PHED,183,Varsity Men's Baseball,0,3,1,"Competitive Baseball on the intercollegiate level, including coaching strategies, offensive and defensive strategies, training, conditioning and team organization. Varsity athletes only or coach's approval. "
PHED,184,Varsity Men's Basketball,0,3,1,"Competitive Basketball, including coaching strategies, offensive and defensive strategies, training, conditioning and team organization, including intercollegiate competition. Varsity athletes only or coach's approval. "
PHED,185,Varsity Women's Basketball,0,3,1,"Competitive Basketball, including coaching strategies, offensive and defensive strategies, training, conditioning and team organization, including intercollegiate competition. Varsity athletes only or coach's approval. "
PHED,186,Varsity Women's Softball,0,3,1,"Competitive Softball including coaching strategies, offensive and defensive strategies, training, conditioning and team organization, including intercollegiate competition. Varsity athletes only or coach's approval. "
PHED,187,Varsity Women's Volleyball,0,3,1,"Competitive Volleyball at the intercollegiate level including advanced technique analysis, offensive and defensive strategies, training, conditioning, and team organization. Varsity athletes only or coach's approval. "
PHED,189,Varsity Golf,0,3,1,"Competitive golf techniques are covered including training, conditioning, team organization advanced technique analysis. Competition at the intercollegiate level. Varsity athletes only or coach?s approval. "
PHED,207,Major Sports Seminar,1,2,2,Development of professional competencies in fundamentals of training methods and objectives of major sports. Development of professional competencies in fundamentals of training methods and objectives of major sports. 
PHED,255,Intro to Coaching Theory,3,0,3,"An introduction to the central principles of coaching. Exploration of coaching as a practice including theories of coaching, motivation, and organization. "
PHED,355,Coaching in Application,3,0,3,Application of the principles of coaching. Application of the theories of coaching across contexts and in various different sports. 
PHED,455,Coaching Practicum,0,6,3,Practical application of coaching theories and methods in context. 60 hours of directed coaching experience. 
PHIL,107,Seminar,0,0,15,(Hours to be arranged each term.) 
PHIL,207,Seminar,6,0,6,(Hours to be arranged each term.) 
PHIL,307,Seminar,0,0,15,(Hours to be arranged each term.) 
PHIL,407,Seminar,6,0,6,(Hours to be arranged each term.) 
PHIL,205,Introduction to Logic,3,0,3,"This course prepares students to critique and assess arguments according to the rules of logic. Students will learn formal and informal methods for assessing deductive, inductive, abductive arguments. Logic is useful for all majors because everthing you learn at OIT is based on arguments. "
PHIL,215,Ethical Theory,3,0,3,"Students will become familiar with some plausible moral theories: Kant's moral theory, Aristotle's moral theory, Utilitarianism, The Social Contract, Feminist Ethics and with some more controversial moral theories: Cultural Relativism, Divine Command Theory, Natural Law Theory, Emotivism. "
PHIL,305,Medical Ethics,3,0,3,"Students will become familiar with Kant's moral theory and Utiliarianism and use them to examine the morality of abortion, paternalism, allocation of medical resources, and the right to die, among others. Students will learn how to make rational moral judgments. "
PHIL,331,Ethics in the Professions,3,0,3,"Applied ethics course that focuses on examining ethical issues common to the professions, such as privacy, confidentiality, social responsibility, and whistleblowing. Emphasizes critical thinking and ethical decision-making skills. "
PHIL,342,Business Ethics,3,0,3,"Business ethics course that focuses on ethical issues commonly found in business, such as whistle-blowing, discrimination, finance, and international manufacturing. Emphasizes critical thinking, critical reading, and the importance of personal ethics. "
PHIL,225,Bioethics,3,0,3,"This course examines questions concerning the value of life and when it is or is not justified to kill or allow life to end. Accordingly, the course addresses a variety of relevant issues like euthanasia, the death penalty, military violence, and what forms of life should be protected.  "
PHIL,255,Ethics and Philosophy of Artificial Intelligence,3,0,3,"This course examines issues concerning artificial intelligence (AI), such as the dangers and benefits of AI development, AI's impact on culture and society, whether an AI could qualify as a person, and what AI development implies about human nature.   "
PHIL,336,Moral Standing and Moral Beings,3,0,3,"This course examines questions surrounding the idea that some beings morally matter for their own sake, and thus have ""moral standing."" Such questions include: What is it that gives a being moral standing? And how do advances in technology, and science, and medicine shed light on the topic? "
PHM,105,Intro to Population Health Management,3,0,3,"This course introduces students to the field of population health management, including the various careers, initiatives, and skills related to population health practice. "
