Prefix,Code,Name,Lecture Hours:,Lab Hours:,Credit Hours:,Description (Rendered no HTML)
No Prefix Chosen,-1,No Course,0,0,0,No Description
ABA,511,Foundations of ABA,5,0,5,"Basic principles, characteristics, and concepts of Applied Behavior Analysis (ABA). Includes history of ABA, terminology, and applications. "
ABA,512,Foundations of ABA II,3,0,3,"Foundational knowledge for practice of Applied Behavior Analysis (ABA): basic principles, characteristics and concepts of ABA. "
ABA,521,Ethics,5,0,5,"Course content includes, but is not limited to, ethical principles, the BACB's ethics codes and requirements, the BACB's code-enforcement mechanisms, and professionalism. "
ABA,525,Research Methods in ABA,5,0,5,"Methods for conducting valid and reliable behavioral measurement and experimental evaluations of behavioral interventions, including data collection, data display, and data interpretation and designing and evaluating behavioral research designs. "
ABA,526,Behavioral Assessment I,3,0,3,"Behavioral assessment including descriptive assessments and functional analysis; methods of assessment, data collection and interpretation; assessment based selection of intervention; ethical and practical issues. "
ABA,531,Decreasing Behavior,5,0,5,Selection and implementation of behavior assessment and behavior analytic intervention techniques related to decreasing interfering or challenging behavior. 
ABA,532,Increasing Behavior,5,0,5,Selection and implementation of behavior assessment and behavior analytic intervention techniques related to developing new skills or increasing behavior. 
ABA,535,Special Topics in ABA,3,0,3,"Examination of systems, interventions, current issues, and/or advances in Applied Behavior Analysis; includes focus on strategies for managing program implementation and supervision of behavioral change agents. Topics vary. "
ABA,598,Practicum,2,0,2,Practical experience in Applied Behavior Analysis. Students will have the opportunity to develop proficiency in behavior analytic consultation and service delivery.  May be repeated for credit.   
ABA,501,ABA Colloquium,1,0,1,"Weekly seminar focused on current topics, research in ABA. May be repeated for credit. "
ABA,515,Basic Behavior Analysis,3,0,3,"Experimental analysis of behavior, human and non-human research, basic principles of operant and respondent conditioning. "
ABA,516,ABA and Human Development,3,0,3,"Typical and atypical development across the lifespan, emphasis on behavioral theories, principles, and applications. "
ABA,527,Behaviorism,5,0,5,"Underlying theoretical and philosophical foundations of behavior analysis (i.e., behaviorism). "
ABA,536,"Behavior, Physiology, and Pharmacology",3,0,3,"Interrelationship of physiological and behavioral processes, includes psychotropic medications, drug effects and interactions. "
ABA,565,Organizational Behavior Management,5,0,5,"Performance analysis and management, supervision, staff training, behavioral systems analysis, organizational culture, and leadership. "
ABA,566,ABA and Education,3,0,3,"Applications of behavior analysis in education; instructional design and classroom behavior management applications in education, special education, and college instruction. "
ABA,599,Thesis,variable,0,variable,Supervised research experience for the thesis leading to the master's degree in Applied Behavior Analysis. May be repeated for credit. 
ABA,507,Seminar,7,0,7,(Hours to be arranged each term.) 
ABA,524,Observations and Measurements,2,0,2,"Theory and practice related to the BACB Task List items related to observation and measurement including: methods for conducting valid and reliable direct observation techniques including data collection, data display, and data interpretation; methods for calculating inter-observer agreement. "
ABA,546,Behavioral Assessment II,2,0,2,"Assessment and measurement techniques related to skill deficits in children and adolescents with developmental or intellectual disability. Includes VB-MAPP, ABLLS, PEAK, EFL, AFLS, Vineland, social skills assessments, and others. "
ABA,547,Supervision and Management,3,0,3,"Methods of behavior analytic personnel supervision and management including but not limited to ethical and professional responsibilities, establishing performance standards and goals, feedback, behavior skills training, problem solving, and evaluation of the effectiveness of supervision. Additionally, this course will serve to fulfill the curriculum requirement for the BACB Supervisor 8-Hour Training based on the Supervisor Training Curriculum (2.0). "
ABA,522,Ethics & Professional Issues II,3,0,3,"Examines ethical and professional issues in Applied Behavior Analysis (ABA) focus on Compliance Code and application to ethical and professional conduct, ethical decision making, and professional practices. "
ABA,502,"Intro to Training, Science, & Practice of ABA I",1,0,1,"First of three term sequence to prepare students to benefit from supervised fieldwork and to practice as behavior analysts. Focus on requirements for obtaining supervised fieldwork, fieldwork best practices and documentation requirements.  "
ABA,503,"Intro to Training, Science, Practice of ABA II",1,0,1,Second course in three-term sequnce to prepare students to benefit from supervised fieldwork and to prepare students to practice as behavior analysts. Covers assessment and development of time management and interpersonal skills. 
ABA,504,"Intro to Training, Science & Practice of ABA",1,0,1,Third course in a three-term sequence to prepare students to benefit from supervised fieldwork and to prepare students to practice as behavior analysts. Focus on documentation and skills for caseload management. 
ABA,581,Clinical Skills I,2,0,2,"Application of basic skill acquisition procedures including but not limited to preference assessments, assessments to identify behavior in need of increase or acquisition, shaping, chaining, various prompt strategies, DTT and NET instruction "
ABA,582,Clinical Skills II,2,0,2,"Application of basic behavior reduction procedures including functional assessment, antecedent interventions, interventions based on motivating operations, differential reinforcement procedures, extinction, and punishment "
ABA,583,Clinical Skills III,2,0,2,"Case conceptualization skills, by examining real or ""contrived"" cases from intake, to assessment, goal selection and treatment recommendations "
ACAD,101,Student Success Sem,0,0,2,"A course to facilitate the success of first year students at OIT. Emphasis on faculty-student and student-student interactions. Includes academic resources, campus services, the learning process, communication skills, health and wellness issues. May also include academic skills and career planning. "
ACAD,107,Seminar,0,0,12,(Hours to be arranged each term.) 
ACAD,207,Seminar,0,0,12,(Hours to be arranged each term.) 
ACAD,307,Seminar,0,0,12,(Hours to be arranged each term.) 
ACAD,407,Seminar,0,0,12,(Hours to be arranged each term.) 
ACC,107,Seminar,0,0,12,(Hours to be arranged each term.) 
ACC,207,Seminar,6,0,6,(Hours to be arranged each term.) 
ACC,307,Seminar,6,0,6,(Hours to be arranged each term.) 
ACC,407,Seminar,6,0,6,(Hours to be arranged each term.) 
ACC,205,Computerized Accounting,2,6,4,"Spreadsheet software used to solve accounting problems, model-building techniques. Integrated accounting software introduced. "
ACC,320,Cost Accounting I,4,0,4,"Cost accumulation systems including job order costing, process costing and activity-based costing will be explored. Techniques to control and evaluate operations including variance analysis based on flexible budgets and standard costs. "
ACC,321,Cost Accounting II,4,0,4,"Continuation of Cost Accounting I. Strategic planning and financial budgeting. Cost measurement, planning, control and performance evaluation and behavioral issues. The role or responsibility accounting for revenue, cost, contribution and profit centers will be investigated. "
ACC,325,Finance,4,0,4,"Emphasis on working capital management, long-term finance, and capital structure. "
ACC,331,Interm Accounting I,4,0,4,"Financial accounting concepts, theory, and practices involving current asset accounts; practical application of theory to accounting problems. "
ACC,332,Interm Accounting II,4,0,4,"Accounting concepts, theory, and practices involving ownership equities, interpretation, analysis of financial statements, and correction of errors; practical application of theory to accounting problems. "
ACC,333,Interm Accounting III,4,0,4,"Accounting concepts, theory, and practices involving plant assets, intangible assets and liabilities; practical application of theory to accounting problems. "
ACC,305,Accounting Info Sys,4,0,4,Analysis of accounting cycles and the associated controls with emphasis on problem solving and critical thinking. Includes computerized accounting system implementation. 
ACC,411,Income Tax Procedures,4,0,4,Federal and state income tax laws and regulations applicable to individuals and their businesses including computerized tax return preparation. 
ACC,412,Corporate Taxation,4,0,4,"Federal tax law applicable to corporations, partnerships, and estates. Emphasis on tax research procedures, and locating and evaluating various sources of tax law. "
ACC,431,Advanced Accounting I,4,0,4,"Comprehensive study of problems in partnership accounting, fund accounting, branch accounting, and governmental accounting. "
ACC,432,Advanced Accounting II,4,0,4,"Analysis of problems facing small, medium, and large companies, with emphasis upon an integrated and concurrent decision making methodology applying economics, finance, accounting and tax theory. "
ACC,435,Auditing,4,0,4,"Introduction to auditing concepts and practices. Topics include professional standards, audit planning and procedures, ethical considerations, internal controls, professional responsibilities, the acquisition and evaluation of audit evidence, and report writing. "
ACC,496,Senior Project,3,0,3,"Development and implementation of an accounting related project for the benefit of an external entity and the student. Projects will include a proposal, analysis, design, and implementation. An oral presentation and project documentation will be required at the completion of each course. "
ACC,497,Senior Project,3,0,3,"Development and implementation of an accounting related project for the benefit of an external entity and the student. Projects will include a proposal, analysis, design and implementation. An oral presentation and project documentation will be required at the completion of each course. "
AHED,107,Seminar,0,0,12,(Hours to be arranged each term.) 
AHED,207,Seminar,0,0,12,(Hours to be arranged each term.) 
AHED,307,Seminar,0,0,12,(Hours to be arranged each term.) 
AHED,407,Seminar,0,0,12,(Hours to be arranged each term.) 
AHED,450,Instructional Methods,3,0,3,"Students develop instructional content and an instructional plan for teaching topics for adult learners. Teaching methods, learning styles, student and instructor evaluation, and use of media will be discussed. "
AHED,451,Instructional Experience,2,3,3,"Students create and structure their own instructional experience, participate in a clinical or laboratory setting as a supervising instructor, present a didactic unit using visual aids. "
AHED,460,Fund of Distance Education,3,0,3,"Students learn the fundamentals of online teaching and learning. Lesson plan developed in AHED 450 will be finalized as an online module. Synchronous vs. asynchronous learning, instructional design and course management as it relates to online instruction will be discussed. "
ALH,505,Intro to IT for Hlth Care Pros,1,0,1,Students will get an introduction to information technology (IT) as it applies to healthcare and in learning IT tools for success in online education. 
ALH,510,The Science of Evidence-Based Medicine,3,0,3,"Modern health practices often claim that they are ""evidence based"", but sometimes the quality of the evidence isn't as good as one would hope. This course looks at a variety of medical and health issues and evaluates the reliability of the evidence. Topics include menopausal hormone replacement therapy, screening for breast, prostate, thyroid and colon cancer, and nutritional/dietary recommendations. "
ALH,515,Scientific Writing & Healthcare,3,0,3,"A large focus of this class is in reading and interpreting scholarly literature related to healthcare leadership. In addition, students will be learning to write using instructor led professional and scientific methods. "
ALH,525,Effective Healthcare Ldshp.,3,0,3,The students will explore best practices in team leadership including theam theories and safety concerns as they apply to healthcare. Real life case examples will be taught and the students will be able to practice their team leadership skills to learn how to effectively lead healthcare teams. 
ALH,535,Assmt. Plan. Imp. and Eval.,3,0,3,"Focus is teaching students to assess needs, plan effectively, implement changes and evaluate their own success in a healthcare setting. Prerequsite: Admission to the MSAH program "
ALH,545,Pertinent Ethical & Legal Cons,3,0,3,"Common real-life healthcare ethical cases will be presented and discussed in this class with a focus on the role of a healthcare leader in handling difficult ethical situations. Healthcare legalities will be introduced to help with liability and malpractice, etc. "
ALH,555,Leadership Theory for HC Ldrs.,3,0,3,"A wide range of scholarly leadership theories will be discussed, ranging from military leadership models to Gardiner's Servant Leadership Model. Students will self-assess to evaluate their own leadership and communication styles along with their own power and influence styles. These research based leadership theories will be applied to healthcare leadership and best practices. "
ALH,565,Population Health Issues for Allied Health Professionals,3,0,3,Population health issues and needs will be discussed in all aspects particularly as it applied to healthcare leadership. 
ALH,575,Methods of Research for Allied Health Professionals,3,0,3,"The various types of healthcare research will be discussed including qualitative, quantiative, and mixed methods. Students will design their own research project that will include data collection and analysis, with particular attention given to the planning process of the research and choosing appropriate methodology. Prerequsite: Admission to the MS MAH program "
ALH,585,Financial Consid. & Pol. Strat,3,0,3,Students will be introduced to best practices in healthcare finances including health care policies and funding sources. The emphasis will be to teach students how to incorporate successful financial models into their own healthcare organizations. Discussions will take place to include the best practices in using political models and stratagies related to demand and supply within healthcare settings. Prerequsite: Admission to MS MAH program 
ALH,595,Curriculum Design for AHP,3,0,3,Creating the best healthcare curriculum that ensures the best practices and student outcome will be emphasized. How to manage healthcare curriculum with consideration to needs assessment and program specific accreditation standards will be discussed. 
ALH,506,Program Administration,3,0,3,"The roles, responsibilities and functions of administrators in healthcare and educational environments. "
ALH,508,Medical Ed. Theories & Methods,3,0,3,"Instructional methods for allied health educators. Emphasis on lesson plan design to meet learning style needs of adult learners. Learning objectives, active teaching strategies, traditional and non-traditional assessment, and evaluation are addressed for teaching in an on-campus or online environment. "
ALH,509,Masters Capstone Project,6,0,6,"The capstone project is designed as a culminating clinical experience and provides an alternative to the thesis option. The student must present a formal capstone project plan prior to beginning the project to his/her graduate committee. Upon completion of the experience, the student will provide a written evaluation of the project. The student will also preform an oral presentation and oral defense to his/her committee. "
ANTH,101,Intro to Physical Anthropology,3,0,3,"An introduction to physical anthropology, emphasizing man's place in the animal kingdom, evolution of man, fossil hominid forms, Paleolithic cultures, and principles of genetics. Satisfies either a science elective or a social science elective. "
ANTH,102,Intro to Archaeology,3,0,3,Survey of the science of archaeology. Covers the biological and social evolution of the human species with emphasis on the growth of human populations and social complexity. Relates site-specific evidence to theories of social change. Discusses field and laboratory methods of archaeology. 
ANTH,103,Intro to Cultural Anthropology,3,0,3,"Culture, language, subsistence patterns, group formation, kinship, economic systems, political organizations, religion, and cultural change. "
ANTH,107,Seminar,0,0,12,(Hours to be arranged each term.) 
ANTH,207,Seminar,6,0,6,(Hours to be arranged each term.) 
ANTH,307,Seminar,0,0,12,(Hours to be arranged each term.) 
ANTH,407,Seminar,6,0,6,(Hours to be arranged each term.) 
ANTH,452,Globalization,3,0,3,"Addresses what globalization is and how it developed and spread. Benefits and harms of globalization in the areas of work, culture, warfare, national sovereignty, health, and food. Countervailing pressures from social movements will be examined. "
ART,107,Seminar,15,15,15,(Hours to be arranged each term.) 
ART,207,Seminar,6,0,6,(Hours to be arranged each term.) 
ART,307,Seminar,15,15,15,(Hours to be arranged each term.) 
ART,407,Seminar,6,0,6,(Hours to be arranged each term.) 
ART,205,Introduction to Watercolors,3,0,3,Introductory studio course in beginning watercolor painting. Students will learn a variety of watercolor techniques as well as elements of design and aesthetics. 
ART,220,Basic Drawing,3,0,3,"Designed for the student who has an interest in exploring the field of pictorial representation but has had, for a variety of reasons, little opportunity to do so. "
ART,226,Digital Photography,3,0,3,"Studio course in digital photography, studying and producing photographs. Focus on digital exposures, color, location, Photoshop techniques and issues in photography. Students must have the use of a digital SLR camera or a digital camera with manual settings. "
ART,282,Intro to Acrylic Painting,3,0,3,Introductory studio course with emphasis on basic materials and techniques in acrylic painting. 
ART,215,Design Arts and Aesthetics,3,0,3,"Students learn how to think like designers through critical analysis of design principles, enabling them to differentiate between good and bad design as well as how to influence perception, increase appeal, and problem solve when designing. "
ART,315,Design Thinking,3,0,3,"Students learn how to collaborate and tackle complex problems through creative design strategies, and develop an ability to define the problem, increase empathy, ideate and pitch their idea. "
BA,211Z,Principles of Financial Accounting I,4,0,4,"Imparts an understanding of the purpose of accounting, common financial statement items, and the principles of internal controls. Focuses on recording the impact of economic events on account balances using U.S. Generally Accepted Accounting Principles, and the creation and analysis of financial statements to aid in external decision making. "
BA,212,Prin of Accounting II,4,0,4,A continuation of BA 211Z with emphasis on corporate accounting. 
BA,213Z,Principles of Managerial Accounting,4,0,4,"Builds an understanding of the role of managerial accounting in a business, focusing on the development and use of information to evaluate production costs and operational performance in support of short- and long-term organizational decision-making. "
BA,101Z,Introduction to Business,4,0,4,"Presents an integrated view of both established and entrepreneurial businesses by studying their common characteristics and processes in a global context. Introduces theory and develops basic skills in the areas of accounting, finance, management, and marketing, with an emphasis on social responsibility and ethical practices. Explores how businesses can create value for themselves and society by addressing environmental and social challenges. "
BIO,101,Intro to Cell Biology,3,3,4,"Introduction to cell biology, genetics, basic chemistry of living organisms, and the scientific method. "
BIO,102,Diversity of Life,3,3,4,"Evolution and phylogenetics among all major groups of living organisms, including bacteria, protists, fungi, plants and animals. "
BIO,103,Intro to Human Anat & Phys,3,3,4,"Basic human anatomy and physiology, including a survey of all major bodily systems. (Cannot be used for graduation credit by students who have taken BIO 231, BIO 232, and BIO 233). "
BIO,105,Microbiology,3,3,4,"Classification, morphology, reproduction, transmission, and control of micro-organisms causing disease in man. Laboratory practice in culturing methods, microscopic observation, and physical and chemical control. "
BIO,107,Seminar,15,15,15,(Hours to be arranged each term.) 
BIO,207,Seminar,6,6,6,(Hours to be arranged each term.) 
BIO,307,Seminar,15,15,15,(Hours to be arranged each term.) 
BIO,407,Seminar,15,15,15,(Hours to be arranged each term.) 
BIO,109,Intro to Medical Sciences,1,2,2,"Survey of medical and health-related occupations, including biomedical sciences. Discussion of health care structure, private and public entities, the research community, and trends in health education and practice. "
BIO,135,Prep for Human A&P,1,0,1,Study techniques for a science course are explored using examples of Human Anatomy and Physiology. 
BIO,200,Medical Terminology,2,0,2,"Basic structure of medical works including prefixes, suffixes, roots and combining forms. Correct spelling, pronunciation, and meaning of terms are stressed. "
BIO,205,Nutrition,3,0,3,"A study of the relationships of food and nutrition to health. An overview of the basic nutrition principles including the nutrients and how they function in the body, nutrient requirements, diet planning, and energy balance. Current topics and controversies are examined. "
BIO,209,Current Research Tpc Med Sci I,1,0,1,"Introduces students to topics in medicine focusing on global health issues, infectious and chronic diseases. Projects in medical literature research, understanding scientific paper format, preparing techinical presentations and public speaking. "
BIO,211,Principles of Biology,3,3,4,"Principles of modern biology emphasizing form and function of multicellular plants, major invertebrate phyla, and general vertebrate morphology and physiology. "
BIO,212,Principles of Biology,3,3,4,"Principles of modern biology emphasizing evolution, ecology, population genetics, and behavior of organisms. "
BIO,213,Principles of Biology,3,3,4,"Principles of modern biology emphasizing the biochemical basis for life processes, cell structure, and function. Molecular genetics, cell reproduction, metabolism, and form and function of microorganisms. "
BIO,216,Intro to Veterinary Medicine,3,3,4,"Covers many aspects of animal health care and their impact society. Discussions cover husbandry, anatomy, preventive medicine, common diseases and behavioral problems of dogs, cats, horses and exotics. Some hands-on work with dogs, horses, and wildlife is included. "
BIO,220,Cardiovascular Physiology,3,3,4,"Application of principles of fluid dynamics to the human vascular system. Detailed considerations of cardiac function and its regulation, analysis of flow in arterial, venous and capillary systems, and integration of cardiovascular regulation. "
BIO,226,Intro to Wildlife Rehab,3,0,3,"Principles of wildlife rehabilitation including state and federal laws, medical terminology, basic anatomy, natural history and diet, form and function, and euthanasia. Field captures, basic restraint, first aid, minimum housing requirements, and zoonotic diseases are also included. "
BIO,227,Intro to Forensic Science,3,3,4,"An entry level course exploring the methodologies and procedures utilized by crime scene investigators and forensic laboratories. Emphasis on crime scene investigation, recognition, documentation, and collecting of physical evidence. Laboratory exercises provide hands-on opportunities supplementing lecture topics. "
BIO,231,Human Anatomy/Physiology I,3,3,4,"Introduction to the systematic studies of human anatomy and physiology. Introduction to cytology and histology followed by the integumentary, skeletal, muscular and endocrine systems and the physiology of excitable tissues. The laboratory sessions emphasize human anatomy using models and human cadavers. "
BIO,232,Human Anatomy/Physiology II,3,3,4,"A continuation of the systematic study of human anatomy and physiology. The nervous, cardiovascular and immune systems are studied. The laboratory sessions emphasize human anatomy using models and human cadavers. Dissections and physiological experiments are conducted. "
BIO,233,Human Anatomy/Physiology III,3,3,4,"Conclusion of the sequence in human anatomy and physiology. Digestive, respiratory, renal and reproductive systems are examined. Metabolism, human genetics and development are also studied. Laboratory sessions emphasize physiological experiments and human anatomy using models and human cadavers. "
BIO,235,Human Genetics,3,0,3,"Genetic concepts using human examples, including the molecular and cellular basis of inheritance, patterns of inheritance, basic pedigree analysis, mutation, single-gene and polygenic diseases, and an introduction to genetic biotechnology. "
